{
  "schema_version": "1.0.0",
  "binding_type": "lifecycle_draft_governance",
  "evidence_id": "draft-governance-b418432a998bd54c",
  "phase": "generation",
  "role": "generator",
  "target": "milestones/M1_project_memo.md",
  "receipt_id": "fd505454-22fd-4d9c-b7d8-8a30a2f6fd3a",
  "semantic_usage": "not_invoked",
  "contract": {
    "root": "project",
    "path": "reviews/.harness/draft-governance/m1-initial-generation/contract.json",
    "sha256": "2ece1cb7d4d8505ed633a79ac4c08315fd5f2cb6b77bb7d83a7d2baaa7e722fb"
  },
  "obligation_receipt": {
    "root": "project",
    "path": "reviews/.harness/draft-governance/m1-initial-generation/obligation-receipt.json",
    "sha256": "e1d04ec099290fa0c8a1ae361cc1f5d0e132d2784298e30d9e3e389724960030"
  },
  "verified_envelope": {
    "root": "project",
    "path": "reviews/.harness/draft-governance/m1-initial-generation/verified-envelope.json",
    "sha256": "b418432a998bd54cbbcbf5cdeb23035defd3a99ffd022c74f564c89019121ac0"
  },
  "dispatch_claim": {
    "root": "project",
    "path": "reviews/.harness/assignment/dispatch/claims/dispatch-c97fc10d84b915dc/claim.json",
    "sha256": "2a99c05d7397bf793c79e980aa66e7c5167152cd66c986d6ca405337e6a98b5d"
  },
  "dispatch_consumption": {
    "root": "project",
    "path": "reviews/.harness/assignment/dispatch/consumptions/consume-c007eefc8e47754b/consumption.json",
    "sha256": "10c7a73c3866662ad60641936adc4f7ea71d685df55bb5e3e86cf0c7ec640676"
  },
  "lifecycle_inventory": {
    "root": "harness",
    "path": "assignment-milestone-checkpoint-a11mf69l/native-v2/reviews/.harness/draft-governance/alternate-inventory.json",
    "sha256": "684efbe9b978e5b8172599f28e41088d59ea2086390fd4d7699695e012ff6ec4"
  }
}
